{
  "compatibility_version": 1,
  "contract_id": "unical-normalized-datasets",
  "contract_version": "1.0.0",
  "coverage": {
    "aulas": {
      "total": 517,
      "with_building_id": 517,
      "with_capacity": 280,
      "with_floor": 329
    }
  },
  "datasets": [
    {
      "name": "aliases.json",
      "records": 1374,
      "sha256": "eea2fef87e4809ab6e929ca84a4766ddbeb2d6d21ab639d2b45d8bbf348f7466"
    },
    {
      "name": "aulas.json",
      "records": 517,
      "sha256": "cdb73ae9fba30aaf17e96abfd2cf2a55c15101a7ade80907eca0cc52116fdabd"
    },
    {
      "name": "building_entrances.json",
      "records": 0,
      "sha256": "37517e5f3dc66819f61f5a7bb8ace1921282415f10551d2defa5c3eb0985b570"
    },
    {
      "name": "buildings.json",
      "records": 151,
      "sha256": "3fddc933673eed144143655dd32124de6c6b9537bdf11d2fd2f421ffaf3b8e55"
    },
    {
      "name": "departments.json",
      "records": 14,
      "sha256": "d8564414668fd8a267f82d44b75a865e397a41220b15727fe922c44ff06d324e"
    },
    {
      "name": "faqs.json",
      "records": 0,
      "sha256": "37517e5f3dc66819f61f5a7bb8ace1921282415f10551d2defa5c3eb0985b570"
    },
    {
      "name": "glossary.json",
      "records": 0,
      "sha256": "37517e5f3dc66819f61f5a7bb8ace1921282415f10551d2defa5c3eb0985b570"
    },
    {
      "name": "people.json",
      "records": 4156,
      "sha256": "e5242ccbd0f766c192dbd1f43702b18816b286b9472c80f854fb4a659ce98aa1"
    },
    {
      "name": "places.json",
      "records": 880,
      "sha256": "fbe6424a4a38d883e1fc44f7cfa7497ca005ddd2cca58d398301b7af0f89b156"
    },
    {
      "name": "sources.json",
      "records": 5,
      "sha256": "9685089b9153acaf31fe898a6a9a66a5616eb34f245ed6fff89cacc605fda1e3"
    }
  ],
  "revision": "27ad42ad3e81d064a03bb635c990040c2be4f3d0947ca7abd1d00dcba8f26530"
}
